,Rating,Review_Title,Review
319,8,Decent,"I think this movie is amusing and decent. With its interesting storyline, good characters, a surprise plot twist towards the end, and so much more are sure to keep you entertained. I don't like the scene when Han Solo gets frozen. But all in all, I recommend you give this a try."
320,,It's easy to say. It's more difficult to explane: The best movie ever made,"The saga continues (please excuse me for some dumb spelling mistakes, they just got here)... The first Star Wars movie didn't really turn me into a deep star wars fanatic, but I must say, theese three movies are my absolute favorites!"
321,10,Rich and Rewarding...Beautifully Done...Perfect Production Personafied,Anticipation...
322,10,Pure Brilliance,This movie was a work of art as was the trilogy. It is a trilogy that we will never see the likes of again (though Godfather 1-3 and the Lord of the Rings trilogy have there place in cinema history as well).
323,9,One of the greatest movies of all time,"After the indescribable success of the first amazing Star Wars film, people were hungry for more, so George Lucas decided to go ahead and make a sequel."
324,9,There is a great disturbance in the Force.,"Sound, Art, Music, Special Effects, Costuming - these all make this a film worth revisiting on a Hi-Def TV. Even without the Hi-Def cable, this is a special film to watch and enjoy."
325,10,The Empire Strikes Back: A Classic That Lives Up To The Hype,"If you haven't seen The Empire Strikes Back yet, stop what you're doing and watch it right now! This film is the epitome of a timeless classic and a must-see for any movie lover. Even if you're not a Star Wars fan, the plot, characters, and special effects will captivate you from beginning to end."
326,10,"Not just one of the best sequels ever made, not just one of the best science-fiction movies ever made but also one of the best movies ever made.",Widely this movie is known as perhaps the best sequel ever made. However calling this movie the best sequel ever made alone is not enough. It's so much more than just a sequel and it's overall one of the best movies ever made.
327,,The best of the trilogy!,"THE EMPIRE STRIKES BACK (1980) **** Mark Hamill, Harrison"
328,7,Better than the first one.,"After so many years of postponing I finally decided to watch all the Star Wars movies. Since there are different ways to watch it I'm going for the chronological order and not the release date order, that just makes more sense to me. Maybe I watched a couple movies when I was young, I probably did, but I don't remember anything about it so to me it's all new and maybe one day I will understand the whole hype about the Star Wars saga. After watching The Phantom Menace, Attack Of The Clones and Revenge Of The Sith, Solo: A Star Wars Story, Rogue One, and A New Hope it's now time for The Empire Strikes Back. I thought A New Hope was the weakest one, okay it's the oldest one and so the special effects are not of the same level as more recent ones but the truth is that the later ones are just of better quality in every domain. the Empire Strikes Back was already a bit better but still not of the same quality as the others. I probably watched it as a kid and gave up after that as it's just not that good. I don't know why this one gets such a high rating, it's definitely not better than any of the previous titles mentioned. I agree that the used special effects at that time might have looked good for 1980 but still it doesn't make it better. For that the story and the acting were just not of the same quality. By watching the saga in chronological order you appreciate every movie better than in order by release date. It's just a better way to watch the whole saga, it's much easier to follow and for somebody new to it like me it's just much more appealing.The Star Wars saga is great because of the different characters, races of aliens, and the different spaceships and weapons, for that I just love it. I can't wait to watch the next one, will probably binge watch the eleven movies and will probably squeeze The Mandalorian between it, as long as the chronological order is respected. This was the seventh movie of eleven in barely 72 hours for me, next one today will be Return of the Jedi in the hope the quality still continues to improve, looking forward to it."
329,10,re-watched for the millionth time,"i wanted to briefly state that this is how films and sequels should me made, i know i am not stating new ground here but the sophistication of this film makes me wonder why the template hasn't been used more. it doesn't pick up where we left off, we aren't treated as morons with constant plot explaining, it ends with hope lost. can we have more of this, i don't like happy endings, never seems real in a movie. Han solo being froze is my favourite thing. the twist is a classic move, lando comes in and is instantly a great character, the universe becomes more expanded. the effects look better, i don't know why this isn't higher than 12th at the time of writing, i just wanted to state i love this film"
330,7,"Fun, imaginative, iconic space adventure with a kick-axx cast","""Star Wars V: The Empire Strikes Back"" (1980) was the anticipated follow-up to the initial mega-hit blockbuster from 1977. It's an epic, but simplistic space fantasy about an evil empire and the noble souls who dare to fight it. The main cast features Mark Hamill (Luke Skywalker), Harrison Ford (Han Solo), Carrie Fisher (Princess Leia), Billy Dee Williams (Lando Calrissian), Alec Guinness (Obi-Wan Kenobi) and the voice work of James Earl Jones (Darth Vader), Frank Oz (Yoda) and Clive Revill (Emperor)."
331,10,More creatures and excitement as the trilogy continues,"From the overwhelming success of the first Star Wars film (""Episode IV - A New Hope"") the movie-going public was chomping at the bit in anticipation of this second film. It came out three years after the first and continued the mystique of the first film. The fans flocked to the theaters, and the critics couldn't heap enough praise on the production."
332,10,Still the most visually stunning entry in the Star Wars series.,"This for me is the best Star Wars movie...I even like it more than the first one.  Even today I find it visually stunning and it looks a lot better than anything in the most recent two Star Wars films.  The plot is a bit darker as this film in the series seemed to be more aimed at adults, but kids could enjoy it too.  It is a shame that the one scene in this film that is the most memorable will be kind of wiped out thanks to the new trilogy.  You know the one with Luke facing Vader and Vader makes the startling revelation.  Anyone who watches these movies in the so-called correct order is not going to be very surprised.  Though if they do watch it in order they may never get to this classic cause they will probably stop after the Clone Wars cause lets face it the new triology just isn't very good.  Watch the original trilogy and forget the new...I just wish these were availble on dvd."
333,9,Best Of The Series,"Episode V is the finest entry of the first two trilogies, since it is the best written(really strong dialogue, situations, and realistic evolution of the returning characters) phenomenal direction by Irvin Kirshner(exciting and breathless, always something going on of interest) and equally spectacular F/X, which still hold up(did not need much tweaking for the Special Editions) Story has the Empire striking back(of course!) against the rebellion(despite the loss of the Death Star) and our heroes'(Mark Hamill, Harrison Ford, and Carrie Fisher returning as Luke, Han, and Leia) attempts to survive and enact their next plan of attack, only to become captured by an unwitting betrayal of old friend Lando(Billy Dee Williams, quite smooth but appealing). Climactic battle between Luke and Darth Vader is legendary, and breathtaking. Cliffhanger ending sets up the next chapter nicely."
334,10,Star Wars doesn't get any better than this.,"You've gotta admire George Lucas' moxie. It was bold enough that he sought out to self-finance ""The Empire Strikes Back"", but the movie has to be a downer on top of it. Make matters worse, he ends on one humdinger of a cliffhanger that people had to wait 3 years for resolution. That's sheer balls. "
335,6,What I don't like about this one...,"I'm probably gonna be the Most Unfashionable & Despised Reviewer Alive for saying this, but I am not a huge fan of this episode. In fact, I consider it to be the weakest in the story. Now, when you've stopped hyperventilating, I'll explain why."
336,,irresistible,"I see it. again and again. it was only part from Star Wars trilogy present in Romanian Comunist theaters. and wise Yoda, terrific Darth Vader, courageous Jedies was perfect bridges far from reality. secret of success - the nuances of fairy tale more than a SF. or only the good taste of freedom and the adventures of heroes as small drops of soup-opera. sure, artistic is wonderful creation. but it remains a sentimental product. fight scenes, the cold Darth, the war of David against Goliath, the traces of stories from so many places, the vision of George Lucas, the joy to be child without necessity of mask, the sounds, the atmosphere, maybe dialogs makes this movie more than a good prey for artistic temptation but circle of an innocent mode to see things."
337,10,George Lucas' Best,In 1980 I was 8 years old... I still have vague memories of standing outside the movie theater waiting to get in to the (then) new film. I was so excited I could hardly stand still. Once inside the theater I saw what was to become my favorite movie in the Star Wars Saga! 
338,10,A continuation that doesn't have a right to be this good,"""Empire had the better ending; Luke gets his hand cut off, finds out Vader's his father, Han gets frozen, and taken away by Bobba Fett, it ends on such a downnote. That's what life is, a series of down endings. All Jedi had was a bunch of Muppets."" - Dante Hicks, Clerks."
339,10,The best in the SAGA,I gotta admit I never always like Star Wars episode 5 the empire Strikes back. I use to think that it was boring and had too much talking and Information but I grew older and now I study films and notice Why certain things happen and how they make a film better. I will not deny that I am tired of hearing certain scenes but that doesn't happen Often. Honestly if you haven't seen this you must. The only problem I can think Off is the battle between vader and Luke. I want to know why vader didn't kill Luke and what happened to R2. Why did he get dragged down at dagobha What was the point of that scene. The film has a great beginning and a good Ending. Overall as a trilogy it is better than the prequels
340,9,"The ""heart"" of the ""Star Wars"" trilogy...","""The Empire Strikes Back"" does its best to visually surpass the original ""Star Wars"" and the special effects or the creatures' designs are as convincing as the pioneering space epic, there's also a richness of landscapes, taking you from the snowy summits of a cold planet to the tropical jungle, but beyond the escapism, it's the excitement to see again that iconic gallery of characters, Han Solo, Leia, C3PO, R2-D2, Luke, Chewbacca (whose mourning and moaning sounds took a whole other resonance) and a few newcomers. In ""The Empire Strikes Back"", the key word is ""Back"". "
341,10,Part five of a great fantasy series,This is the fifth part of my essay on the themes and motifs of Star Wars.
342,8,The Force Continues.,"Picking up where Star Wars left off, ""Empire Strikes Back"" is the 5th episode in the trilogy, and second film in the series. In this film, Princess Leia, Han Solo R2-D2 and C-3P0 tried to flee the Galatic Empire, but are later captured by Lord Darth Vader. Luke Skywalker is getting Jedi training by Yoda (his first appearance in the series). We see a determined Skywalker trying to master the technique of being a Jedi, and attempt to rescue his friends. What results is another film full with imagination, character development, action and suspense. One of the best heroic scenes, I think, in the movie is when Skywalker tries to master the technique of moving and lifting objects using the Force. The element of friendship and love continue in this film, as we see a growing teamwork bond between C-3PO and Chewbacca, and a love interest between Princecss Leia and Han Solo; all the human drama blends in well with the sci-fi action. Also, Billy Dee Williams first appears as Lando Calrissian, who join forces with Han Solo and the crew to battle Darth Vadar."
343,5,"Way too over-rated. Definitely not in the same class as ""star wars"" and ""Return of the Jedi"".","I was very disappointed upon seeing ""The Empire strikes back"". I expected more in this movie than just the scene where Darth Vader tells Luke Skywalker:  ""Luke, I am your father"".  I was expecting as much excitement and unpredictability as in ""Star wars"".  I'm not saying the movie is bad or boring, but if you compare this the first and the third (or the fourth and the sixth), it just isn't as good, that's all.  However, just like in ""Star wars"" and ""The return of the Jedi"", Harrison Ford's performance is excellent and is the best part, in my opinion, of ""The Empire strikes back"".  But for fans of the trilogy, it's an absolute must-see."
344,9,"""Lucas Strikes Again""","They should title this one ""Lucas Strikes Again."" Once again he managed to create a compelling story (though he didn't write the screenplay OR direct it) where the bad guys keep winning throughout the entire film! I only wish that I could go back in time to see how people reacted when Darth Vader's secret past was revealed -- oh well, that's what I have kids for. Shhh! Don't spoil it for them!"
345,10,Love it,"Best movie of the series, including the latest effort."
346,10,A dark sequel,"Great film, this film does not try to copy the first one, it has its own atmosphere, its own mood. Though or better because of this The Empire Strikes Back is as good as Star Wars I. It was a risk to make this film with Irvin Kershner as the regisseur but he was well worth the try. Thx Irvin for this great film."
347,9,Thank you for Star Wars!,Thank you George Lucas and to everyone involved in bringing us this wonderful movie series! I love Star Wars Episodes 1-6 and it is my favorite movie series.
348,9,Wow!,After almost 40 years movie still looks really good.
349,6,Good but just because it is darker doesn't mean its better.,Star Wars Episode 5 The Empire Strikes Back tells the story of the evil galactic empire attacking the hopeless rebellion after the destruction of the Death Star. One thing that I feel is worth noting right off the bat is that I don't think this film surpasses A New Hope but is ratter on the same level in terms of substance as well as quality.
350,,"The Sequel That Raised The Bar For Sequels, The Empire Strikes Back Is The Finest Episode Of Star Wars Saga","One of the most celebrated film sequels of all time, Star Wars: Episode V – The Empire Strikes Back is the follow-up chapter to George Lucas' revolutionary Star Wars that happens to be both notorious & influential for its much darker ambiance in comparison to the adventurous tone of the original. Regarded by many as the best chapter of the whole saga and memorable for its unforgettable final twist that no one saw coming, The Empire Strikes Back does feature a more involving storyline but thanks to its marred visuals, this was just as difficult to take seriously as its predecessor."
351,,The One That Changed The Playing Field,"""Star Wars: Episode V The Empire Strikes Back"" is a great example of expanding on the universe established in the original one, and turn to a more darker tone and direction that adds depth in everyone's beloved characters and of course, tragedy."
352,,A step down,"Bigger isn't always better. Clichéd, I know, but it's perfect to describe this. Dazzling action sequences and it's not really a big decrease in quality from the first, but some of the creativity and wit is gone, and instead it gets to be too much of an overload. Still, it's pretty entertaining for the most part, the characterizations are once again the best thing about it, and where it leaves the characters in the end is truly fascinating. Unlike A new Hope, I can't say that I totally get the acclaim this one's gotten as the ""best"" in the franchise. Still, this is definitely pretty good and definitely doesn't add a bad taste to the franchise."
353,,Wars Not Make One Great,"In this sequel, Irvin Kershner takes over the director's seat from George Lucas (who is the writer and producer). The movie takes off a couple of months from where its sequel ended. Our favourite heros, R2, Luke, Han, Princess Leia, C3P0 and Chewbecca continue their fight against the dark side (Darth Vader and Co) for freedom and justice. Of course like 'Star Wars', this one holds tremendous nostalgic value for me and, having seen it more than twenty years ago, my memory of this one is fresher than the aforementioned. I especially remember the sequence with Yoda, Luke and R2 that takes place in a marsh."
354,9,The best film of the trilogy...,"Well I have to say that I am a fan of the old and classic movies of the cinema and not the new ones. Star Wars is not just a movie, is the beginning of a new era, it's the beginning and the peak of movies with space and its defense."
355,8,The Star Wars strikes back with an Impossible Classic Sequel.,Star Wars : The Empire Strikes Back (1980) -<br /><br />Brief Review ;-
356,8,Hoth and bothered.,"I can't review ""Empire"" man! What am I supposed to say? ""it's good, yeah"". It's one of the founding films that makes up my cultural mentality. I've been watching it for most of the 40 years that I've been alive. Anyway... let's put something down."
357,9,Better Than Episode IV!,"This movie is a little better than Episode 4 but sill it's just an ordinary science fiction film. It wasn't until Return of the Jedi when some really good science fiction kicks in. There were many good moments in this film with Han Solo and the return of my favorite character, Yoda."
358,10,I'm Your....Reviewer,When I meet people who watched this already knowing the big reveal I pity them and explain how things used to be before the internet and spoilers became almost a sport.
359,,Almost As Good As the Exceptional Original,"The much-anticipated sequel to ""Star Wars"" dazzled audiences in 1980 and is almost as good as its outstanding predecessor.  Darth Vader (voiced by James Earl Jones) and his evil forces do just as the title indicates: they strike back.  An amazing secret that few could have figured out is revealed in the film's finale and leaves the window open for the third installment in the vastly popular series.  Mark Hamill, Carrie Fisher, Harrison Ford, and Alec Guiness all shine again.  Billy Dee Williams also joins the cast and only adds to the terrific screenplay.  Irvin Kershner does a fine job with his direction.  A very good sequel to say the least.  4.5 out of 5 stars."
360,10,Sci-Fi at its Very Finest,"Star Wars: Episode V- The Empire Strikes Back is a fantastic movie with a very well developed storyline and an outstanding cast. It's an impressive sequel that manages to surpass the expectations of its predecessor, this is the standards that every film maker should aim towards when considering a sequel, the first one is fun and introduces the characters in a light hearted manner, but this one further develops them and their universe in a much darker tone. It's definitely the bleakest film in the series, showing the main characters succeed the least, and even the ending isn't particularly joyous, let's just say the title suits the overall tone of the movie perfectly. The cast are still in great form here, in fact several of them have improved between the three year gap of the first movie, Mark Hamill, Harrison Ford and Carrie Fisher have certainly improved as actors and, overall, they seem much more comfortable in their roles. We are also introduced to some great new characters in this film, such as Lando and Boba Fett, but the one who stands out the most for me is Yoda, one of my favourite characters of the franchise, Frank Oz perfectly portrays the wise and woeful personality of this master Jedi. There are so many noteworthy moments here, whether it be the wise words from Yoda, the battle between Vader and Luke or Han's farewell to Leia, every scene makes me smile, it's a piece of film history that will be remembered for years to come. Terrific performances, a thrilling storyline and special effects that still hold up today, fans of Star Wars and sci-fi in general will not be disappointed by Star Wars: Episode V- The Empire Strikes Back, I would recommend it to all moviegoers. "
361,10,The best movie out of the 3,"Out of the first 3 movies this one is clearly the best. Still dear to my heart to this day. It's fun, exciting, breath taking at times but overall joyful"
362,8,Solid sequel,"I saw ""Star Wars: Episode V - The Empire Strikes Back"" in the the theater. I saw the ""Special Edition"" in the theater too. I've seen it many times at home. Every time I watch ""The Empire Strikes Back"" I remember how the audience reacted. I remember when they laughed and I remember when they cheered. Few movies can bring be back to the theater experience like this movie. I don't watch ""The Empire Strikes Back"" as much as I watch the original Star Wars but I still have seen it a bunch of times. It's always an easy watch."
