,Rating,Review_Title,Review
987,10,"Oh where, Oh where has my Star Wars gone.","Well...here we are 30 years ago to the date. This film is every bit the masterpiece it was when I was 14, & it still keeps me entranced at 44. It also bears some very unhappy truths as to where this franchise has gone over the years. This was the film out of the original trilogy that Lucas had very little to do with and it shows. It shines above all the rest as the fans favorite of all favorites. One of the main things that are forgotten about the original trilogy is that these films had very wonderful characters. Those cardboard creations of so called characters in the new films cannot stand up to the band of ragged rebels struggling against the oppressive Empire. The action is brilliant & helps the story instead of being pointless & an excuse for CGI overkill. I can only hope that once the Lucas legacy is passed on, new blood will continue on to breathe fresh air into this awesome vehicle of fantasy. That the directors of tomorrow won't be so self gratifying & think of the responsibility to fans foremost. Every time I see another Clone Wars rehash I wonder what happened to X-wings, Tiefighters, the Millennium Falcon. Han, Leia, Chewie & Luke. Where are MY characters? How long do we have to be tortured with stories about a self absorbed brat who becomes a tyrant, & a bunch of substance-less clones & goofy comedic robots(totally absurd). Get out from behind that pile of money Lucas & give us back OUR STAR WARS!!!!!!"
988,9,Amazing movie!,"Movie is just very great, i don't have anything bad to say about it."
989,10,Shadows of the Empire,"Star Wars, having barely entered the world's screens, became a classic of cinema. The history of the confrontation between the Alliance and the Galactic Empire has captured the imagination of millions of people. The audience simply demanded that the creators continue."
990,9,The Best Star Wars Movie,"This is the best of all 5 Star Wars movies.  With this came the rare sequal that isn't just a redo of the previous movies, but brings something new and different from the first.  In this, we get a startling revelation (well, at least in 1980 it would have been startling; that thing's been so spoofed, you'd have to live in a hole in the ground to miss it; but anyway, I digress), a question to tickle us for the next sequal, the best battle in all of the Star Wars movies, and a love story between Han and Leia.  This was more of an original story than the other sequals, since the story line revolved more around the individual characters than a great threat to the galaxy or a planet(Ep. 6:  A Death Star, how original; Ep. 1:  Naboo under attack).  The acting was good and the special effects were good even for an '80s movie (especially for an '80s movie).  Overall, best of the 5."
991,9,The Saga Continues,"Not only is 'Empire' as good as the original 'Star Wars', it surpasses it by light years."
992,10,"The best of the three (really, the best of the six)","What a movie. I remember crying when I found out that Vader is Luke's father (Granted, I first saw this when I was six, but still). It is easily the darkest of the original trilogy - nothing good happens to any of the heroes, but plenty of bad things happen. On the plus side, the rebellion lives to fight another day, and certain relationships are enhanced, and our main protagonists characters are further developed."
993,10,Star Wars: Episode V- The Empire Strikes Back,"The rather dark of the original trilogy starts on the planet Hoth, an icy, cold planet where the Rebels have set up their base camp, and the Empire goes to destroy it.  After a really cool Snow Speeder vs. Imperial AT-AT and AT-STs, the movie takes an entirely different course from the first, and at the end, revealing a secretthat would rock Star Wars devotees worlds (as to what the secret is, we know it's that Darth Vader is Luke Skywalker's father). This ""episode"", not written by Lucas, but by Leigh Brackett, is, what some may call, the one that broke the rule.  That rule being that ""Sequels are never as good as the original.""  I'll admit, I differ from them slightly.  Toward the end, I found myself anxious for it to end (probably because I had to use the restroom).  Upon further viewing (and time alotted for restroom breaks), I found it much more enjoyable. The enstallment offers a lot more than the forementioned surprise, but it introduces several characters, a small, swamp dwelling Jedi Master named Yoda (voiced by Frank Oz), the sleazy ruler of the cloud city of Bespin, Lando Calrissian (Billy Dee Williams), and a faceless bounty hunter, hired by Jabba the Hutt to capture Han Solo, named Bobba Fett.  This is truly a worthy installment in the Star Wars Trilogy. A"
994,10,The Best Movie,"The Empire Strikes Back is quite simply the best movie that I have ever seen.  The acting is well done, the story is captivating, the scenery is amazing.  The Empire Strikes Back begins after the original Death Star has been destroyed.  The Rebel Alliance is still, however being chased across the galaxy by the evil Galactic Empire.  In this episode, the relationship between Han Solo, the coolest freighter pilot ever, and Princess Leia is beginning to evolve into a love story, Darth Vader's master is at long last revealed, Yoda, the wise Jedi master is sought out by Luke Skywalker at the instruction of Obi-Wan, and Darth Vader makes an announcement that will forever change young Luke's life.  The lightsaber duel between Darth Vader and Luke is one of my personal favorite action sequences in the Star Wars universe.  The Battle of Hoth is another memorable action scene where the Rebellion must defend their base against the Imperial forces.  I gave this movie a perfect 10, and hope that everybody goes out and rents it hundreds of times."
995,10,"""Only a fully Trained Jedi with the force as his ally will conquer Vader and his Emperor""","The sequel to George Lucas' fantastical Science Fiction story ""A New Hope"" has a dark and excellent follow up in ""The Empire Strikes Back""- my favourite film of all time. Who could ever imagine that Darth Vader lord of all evil, was once Annakin Skywalker soft-spoken, noble Jedi Knight and most of all Luke's father. We have the debut of Master Yoda, ostensibly a comical character but in truth a deep and thoughtful Lord of the Force If you Haven't seen Empire with it's dark battle between Vader and Luke at the Climax, and the opening for the sequel at the end then my feeble minded friends you simply haven't lived."
996,9,An even more fluid and fun ride than the first one.,"Tomorrow night at Midnight I will see the next chapter in the saga that is Star Wars.  Tonight I watched them all again to refresh my memory of what it is all about to give a better viewing of Episode II: Attack of the Clones tomorrow night at 12 am. 	I initially saw Episode V: The Empire Strikes Back on its opening weekend in a small theater in Crescent City, CA as a touch more than a neophyte movie aficionado.  Hitchcock flicks were my favorite at that time.  Hitch is still one of my favorite past filmmaker with Hawks and Capra close seconds. These days my tastes lean to Scorsese, Aronofsky and the Coen Brothers. Coppola, Speilburg and Lucas are very good, but to me are more great craftsman than great artists.  All have had artistic successes (The Godfather, Schindler's List and THX 1138), but I think they are better craftsman than artists over all. 	Lucas is by far one of the greatest producers and craftsman of all time and has done more for true independent film than possibly any director/producer since Chaplin.  I also feel strongly that Empire is a far better film than Star Wars with tighter pacing, dialog and performances all around.  The was a fluidity that the first one lacked and feel that was built in was not only what was ""tight about it"". 	The ""weaknesses"" of Star Wars as a piece of ""art"", or even craft is dwarfed by its emotional impact and timing of release.  I was ten when I saw it the first time (several weeks after it was released) and I had to share a seat in the front row with my younger brother who didn't like me much at the time.  Once the music started and the words rolled up the screen we didn't care and loved every single second!  All we told our dad when he met us out front afterwards was ""can we see  it again dad, can we see it again dad..."". I saw it eleven time in the theater that summer including three time in a row on a great day.  This is amazing since my town had only one theatre/screen and it was exceptional that it stayed around long enough for me see it as often as I  did.   The Trilogy was the first VHS I ever owned (my mother paid $70 each in 85). 	My point is that emotional attachment, or detachment to a film is equally important to what a person may think of it critically as a piece of art, or entertainment.  I have loved all the Star Wars films and have seen them all except for the first one on its opening day and even the first show of that day with the last two!  All that said however, I wouldn't call any of them ""great films"".  Important and amazing films, ""Hell Ya!"".  Some of the best rides I have ever had, ""Hell Ya!"".  Worth watching all in a row every now and again, you bet. 	Episode V is more of a love story and character developing episode IV which is why it tends to be many folks favorite thus far.  Knowing it will be a blast and finding out that Vader is really Luke's dads only bolsters it.  I think Jedi is the best still and part of that may be the fact that I knew that Blue Harvest was really Star Wars III (episode VI) when they shot all the wonderful ""forest"" scenes.  I didn't watch them do it, but knowing it was happening and that the speeder chases were truly impossible (since I lived and played Star Wars in those woods), yet there they were right in front of my eyes. This may be why it still has the strongest hold on my heart!  I don't think that the story of Jedi significantly better than Empire, but I am more into temptation, redemption and what is and is not destiny which is more deeply explored and acted out in Jedi. 	Love one, love them all it is tough to chose."
997,5,Overrated,"Same weapons used to open a massive hole to escape are barely doing any damage when shooting at each other. Sword battles what you expect to see when you give kids sword toys. Dialogue almost nothing. Story predictable. Falling from higher than a skyscraper, not even a scratch. This is poor writing with no complex characters or complex history. Even GOT season 8 has better writing than this. The animal froze to death but skywalker survived despite laying done with nose/mouth exposed. Empire soldiers miss about 99.9% of the time. 8.6/8 7 for this looks more like nostalgia rather objective scoring of a screenplay, dialogue or action scenes."
998,10,Best Star Wars movie,Empire strikes back is a masterpiece of a movie great action scenes great plot and the greatest movie reveal and the coolest villain in darth Vader who literally defeats the heroes rather easily And also introduces yoda and is easily the best of the original Star Wars trilogy
999,10,An improvement in every way,"Pros: this movie is better than the original in everyway... the actors show more, the action has tension and suspense instead of being fun and fast paced, The music is the best in the franchise, every character from the first is expanded upon and the new characters are fleshed out really well too.<br /><br />It's dark, sad and better than the first"
1000,7,Star Wars V,"A fun, slow, action-packed sequel that makes fans fall in love with the Star Wars saga again. This was a very good, and perfectly made film if you compare it to other films that were released around its time. The movie was one of the most loved Star Wars films ever... but I can't really agree on that. As I mentioned before it was kind of slow, but still surprisingly enjoyable."
1001,5,The Empire Strikes Back,"It's a good movie.. I can see that, I'm just starting to think star wars isn't really my thing, I'm not really interested in the characters. I'm sure for the 70s/80s it was pretty revolutionary but now I'm not so sure, I think nostalgia very much clouds the reviews of the first trilogy. However I'm still gonna continue the series and finish all the movies."
1002,,Achieves a strong overall mood.,"Of all the Star Wars episodes (#3 yet to be seen), this one achieves an overall mood.  Despite the wide variety of settings and worlds, there is a certain Je ne sais quoi about the whole film, in every scene.  You really feel that space is vast, stronger than all the other Star Wars films.  The good guys are helpless from the start, and there isn't really any contrived plot twist or fluke circumstance that saves them.  The story is made believable by the variety of conflicting agendas between (and within) the empire, the bounty hunters, the rebels, and the director of cloud city."
1003,10,Worthy successor,"I must imagine that making a sequel to 'Star Wars' must be like trying to follow Johnny Carson in the Tonight Show. How do you follow up an act that was so well received and set the standard so high? There is a such thing as warming up an audience. It's a totally different matter when you blow them away. In these days, when it is customary to believe that sequels have no chance to equal their predecessor, all one has to do is point to 'Empire Strikes Back' to reject that notion."
1004,9,"It's the story, stupid","Disney-led, CGI-rich episodes hit the bottom since they missed the point."
1005,,Gives sci-fi a good name...,"""Empire"" bypassed the cheerful adventurousness of the first film to where the forces of good suffer dearly and the ultimate force of evil in the film is discovered to have personal ties in the life of the hero. This is ""grown up"" Star Wars and the best written. With the personal and relational battles we as human beings face in life, it's disheartening when evil triumphs over good and when the bad times outweigh the good ones. But that sort of thing is a reflection of how real life works sometimes. This film mirrors that fact effectively. "
1006,,The installment that all Star Wars movies should be judged by,"The original Star Wars was a great movie in it's own right, but the sequel blew that out of the water!! Empire was and still is, so far, the best Star Wars installment to grace our big screens. The plot line was superb and really made for a hell of a ride for us to enjoy. The character development in this movie, from Han to Leia, Luke to Vader, Lando to Han, etc. was perfect. The special effects were taken to a all new level of intensity (the Hoth battle is still one of the best battle sequences ever--real or not). And John Williams' score is phenomenal."
1007,,The darkest movie in the trilogy,"This was the darkest and weakest movie of the trilogy. It was a great sequel, but Return Of The Jedi was even better. It was a fall for the Jedi. That's why they called the third movie Return Of The Jedi because the Jedi ""struck back."" You should see this if you have seen the first one, but it's not the best. A ** out of ****."
1008,10,Best of the trilogy,"This movie is the best of the three. Better lightsaber sequences, and better effects. The realtionship  between Luke and Yoda, especially when Yoda tells Luke not to leave, but he leaves anyway, was great. Han and Leia get a little bit of action, and C-3P0 gets pushed around. The ending was a complete shock for me. I never thought a sequel can be better than the original, I was wrong. A great film, I suggest for everyone to see it. 11/10."
1009,1,There version of The Empire Strikes Back,"This two hour version is a terrible war movie, very violent and I wouldn't want my kids to go through what we went through watching these six piles of garbage. The Empire Strikes back 30 minute version that Garry Hixon put in his files after Innerspace, is really really a masterpiece. Unfortun- ately Disney would not allow it to actually be released. I only get about 30 hits a day on my 4 videos and im sorry to say, don't have the money to release too many more, but there's always hope. I really enjoyed the exp- erience in 1980, but I was a dumb kid, stoned on marijuana and acid. The computer graphics were very avante-garde at the time. Its definitely a love story compared to my version, but is is very long, and very boring. There version of THE FORCE is levitation, which is not the force. The force is feeling it, feeling it, and not using the ability too often, then levitation is possible. Thank you Disney, love Cinderella."
1010,,The Empire of Star Wars Strikes Back Once More!,"What could possibly be criticized in this movie, great action scenes, fabulous story, outstandingly funny dialogue, basically everything a Star Wars movie should have,"
1011,10,**** out of **** / 10 out of 10,"""The Empire Strikes Back"" may be my favorite film of all time. It is certainly the greatest science fiction film ever made. This film has every thing going for it. It has a wonderful and complex story line, brilliant special effects, and wonderful music from John Williams. The imperial march score is one of the greatest film compositions in the history of film. The acting in the film is excellent as well. It is significantly better than the acting in the two most recent additions to the Star Wars saga. The characters in this film are delightful, particularly Yoda as the great Jedi Master. Every scene he is in is extraordinarily interesting. If this film isn't my favorite film, it is certainly in my top three alongside ""Raiders of the Lost Ark,"" and ""Jaws."""
1012,8,The best of the whole trilogy,Darth Vader beats Luke and everything seems to work for the Empire in its quest to destroy the rebels.  Prehaps the best of the whole trilogy. Definitely worth the praise.  Special effects are amazing and even the script works.  Yoda jedi master is introduced and the puppet is the most endearing character in the whole trilogy.
1013,,Man's Finest Achievement!,"In 1982, when I was the lowly age of four, I was introduced into the world of movies. The first film I saw was to have a profound effect on my life: The Empire Strikes Back."
1014,10,"The Greatest ""Star Wars"" film of the all","The original ""Star Wars"" was, without a doubt, one of the most important motion pictures in the history of cinema and still holds up well today as light entertainment. However, its sequel, ""The Empire Strikes Back,"" goes beyond the fairy tale cheeriness of the original, choosing a much darker in depth path. Luke Skywalker, Han Solo, Princess Leia and Chewbacca are all back in this installment and in top form. Lando Calrissian and Yoda make for some welcome additions to the series. The plot keeps the audience of edge the whole time as the Rebel Alliance is dealt a devastating blow by a vicious attack by the Galactic Empire. While Luke Skywalker furthers his quest to become a full fledged Jedi, his friends Han and Leia are desperately trying to out-maneuver the scheming Darth Vader who holds a dark secret in Luke's past. THe cliffhanger ending will have you pumped up for the next installment, the lesser ""Return of the Jedi."" This is more than just a ""Star Wars"" movie, this is a great motion picture."
1015,10,"Best of the Originals, 3rd best of the Saga","You might have read my previous reviews on Star Wars movies and that The Empire Strikes Back is behind ""Jedi"". However after watching all of the saga in this past week I have concluded that this was better than ""Jedi"", but still not as good as Episodes II and III."
1016,10,The greatest sci fi film of all time,"Empire Strikes Back is the prime example of how to do a movie sequel; it furthers the story,raises the stakes, expands the characters and universe, goes in daring new directions, improves the technicals and fixes any of the flaws found in the previous film. Empire is a lot darker than its predecessor and this helps to heighten the drama and make the story more compelling as now we truly see the threat the empire can impose. It becomes more though provoking as a philosophical side to the force is introduced. New, equally iconic and beloved characters are introduced, characters like Yoda, Lando and Boba Fett. This is also the film that truly defined Darth Vader as one of the greatest villains of all time as not only is he made more intimidating but also more complex thanks largely to the infamous twist. Yet the film still manages to be just as fun as the original as we have great space battles and the greatest lightsaber duel of the entire saga. Yet what makes these action scenes so cowling and exciting is our emotional investment we have with the story and characters, you will laugh, cry, feel tense and cheer, once the end credits roll you'll be emotionally drained."
1017,10,The greates Epic ever banned on Film!,The problem with this picture is that it is nearly impossible to top it.
1018,10,More Powerful Than You Could Possibly Imagine,"Who'd have pegged Irvin Kershner as a likely candidate to take over George Lucas's trashily popular STAR WARS franchise? Luckily, the decision was made and Kershner turned in what is, by a long stretch, the best of the series. THE EMPIRE STRIKES BACK is a breathless chase movie but, unusually for this series, plot is allowed to intrude on action and the actors seem to have suddenly found some character. The whole thing is infused with a wonderfully dark operatic quality, greatly assisted by the rich and imaginative visuals. Movies like this need a good hissable villain and Dave Prowse and James Earl Jones as (respectively) the body and voice of Darth Vader turn him into a truly frightening nemesis (rather than the cardboard cut-out he is in the other films), all of which serves to give the whole enterprise a weighty centre that was completely absent from its predecessor."
1019,,BRILLIANT!!,"Why are some people so hard on this movie? Sure, when (spoiler"
1020,10,Flurry of Visual Poetry,"Without a doubt the best of the Star Wars trilogy.  It almost goes without saying.  Even if you like another of the Star Wars film better for whatever reason, you cannot say that artistically and technically that those movies are better.  That would be on the level of saying that the Goodfellas (which is one of the Master's best films)was better than the Godfather(I or II)."
1021,8,Hoth is really fun,"The Battle of Hoth, which the movie begins with, is tremendously well done. The effects used for the creatures and the war machines don't hold up but the setting and story more than makes up for it. This movie is so much better than the first. The characters are great, and it just feels a good aftertaste. Great twists. Unlike in the new movies (I don't mean the prequels, but the new movie trilogy) where character arcs just jump ahead whenever it's required by the story, in this movie, you see the characters progress and become different. It's a must-watch. Really great, despite its aged appearance."
1022,,Best Movie Ever Made,"Continuing where Star Wars: ANH left off, TESB is a nonstop ride.  The characters are at their best, the settings are the best of the trilogy, and John Williams' Imperial March Theme (perhaps his best work) is introduced. Who can ever forget the Hoth attack or the duel between Vader and Luke on Cloud City."
1023,,short reviews,"DIRECTOR:IRVIN KERSHNER CAST:MARK HAMILL, HARRISON FORD, CARRIE FISHER, BILLY DEE WILLIAMS, ALEC GUINESS, AND THE VOICES OF JAMES EARL JONES AND FRANK OZ."
1024,10,Do or Do Not. There is No Try,This movie took the the first movie and amplified it by ten times. The budget was bigger. The actors where better. The Special Effects were better. And the fan base was established. George Lucas did not direct this one. Maybe that's what made it good. Some one else had delivered his message.
1025,10,I know,"Bom bom bom... bommmm bom, bom bom bom... bommmm bom! Has to be one of the most iconic, if not the most, iconic entrance theme tunes of all cinematic and tv history! Everyone knows it and if they don't then they would've been under a rock their whole lives. Star Wars has had such an impact on the cinematic world! I'm sure Mr Lucas had no idea how much it would change the world either. Ever since a new hope came out people began to dream of the stars and picked up sticks to become Jedi."
1026,10,not so comic book styled after all...,"The reason I love ESB the most is because it is the most humanistic of the whole Star Wars universe.  That's not to take anything away from the others (which i totally love as well!), but they all strike me as more comic book styled.  The whole Han and Leia interaction (and perhaps this may have been due to Harrison Ford and Carrie Fisher and their 'alleged' relations) just comes across as sincere and real. So go the mighty sequel and here's hoping the characters in Episode II are not as wooden as in the Phantom Menace!!"
1027,9,Best Star Wars Episode,Probably the best best movie in the Star Wars series so far. The pieces all comes in to place as Darth Wader reveals his true identity as Luke's father and for the first time Luke acts like a man more than a boy scout.
1028,10,The Life of Star Wars,"I miss the old SW, have so much soul SW<br /><br />creative and bold SW, real subvert expectation SW<br /><br />I hate the new SW, the bad script SW<br /><br />Trilogy didn't plan SW, tell off the fans SW<br /><br />I miss the sweet SW, have so much soul SW<br /><br />I gotta to say at that time I'd like to watch SW<br /><br />See inspire by SW, it wasn't any SW<br /><br />And now I look and look around and there's so many SW?"
