,Rating,Review_Title,Review
604,,great movie,Empire Strikes Back is the continuation of the Star Wars series which involves Darth Vader trying to find the rebels and to get Luke Skywalker to join the Darkside. It opens on the plant Hoth and then we are taken on different adventures. Luke and R2 go to the planet Dagobath looking for Yoda to teach Luke about the Force. Han and Leia avoid being detected by the Empire and take refuge at Cloud City. Empire is hailed as the best because the story actually takes off here. Boba Fett is the bounty hunter looking for Solo and The Empire is shown. The ending is dark and paves the way for Return of the Jedi. This is as good as a sequel can get. It has excellent scenes including Yoda and Vader and Luke's lightsaber battle. ****
605,9,my second favorite in the series!!,"Let me say that it is my second favorite in the saga. This episode is fast paced , a decent plot and cool special effects!!My favorite one is Return of the Jedi !!it is favorite for special effects though!!This movie also features an awesome score by composer John Williams!The score is classic even if you do not like all of his scores!!Look for future star Billy Dee Williams in this movie as well!!"
606,10,The Dark Side of the Universe is the finest in the saga,"I've been watching Star Wars movies since the age of 5 and though I regard Return of the Jedi as my favorite of the entire series (even topping off the prequel and sequel series), I cannot deny the amount of artistry and storytelling ability this one has. There's a lot of character development and pathos between all the heroes we love and the villains that we want them to confront. I like the fact that the heroes don't always win, gives them a greater chance for us to root for them. rather than have an invincible boring set of heroes. The show stealer here is Yoda himself. Forget the CGI versions, the puppetry and wisdom he exudes in his words are timeless, my favorite is the famous line ""Do or do not, there is not try"". Truer words never said better. When Darth Vader says the famous line, you're going to be wondering what decision Luke will have to do next. I won't reveal anything, but from all of what I have said you'll return to this movie time and time again."
607,9,"One of the best, what can i say","I always loved watching Star-wars and all kinds of Fantasy, Fiction and Sci-Fi genres TV-shows and Movies."
608,10,"Darker, better story, better effects","The Empire Strikes back defied every single expectation from viewers. How could anything be any better than the epic original Star Wars movie? It's not even directed by George Lucas, right? Wrong."
609,10,The Empire Strikes HARD,"Arguably the best Star Wars film, and once again one of the best films ever made. The Empire Strikes Back proved Star Wars a force to be reckoned with, by not pertaining to the sequels of its time and building on the story, characters, and plot. Giving us a darker, fun, adventure filled film that exceeded its predecessor and gave us even more classic film and Star Wars moments."
610,10,The best in the series,"The first Star Wars changed film forever, and the second did it it even more. The effects are better, the writing is stronger, the acting is better, the atmosphere is better. Every last thing is just done better. Unfortunately it didn't get the same recognition from the Academy as the first. The film only got two wins (for effects and score) and a few nominations. That is sad that it didn't get the same kind of recognition as the first. I love this movie. I love it from start to finish. It is for sure the best in the series, and without a doubt a cinematic piece of gold. I love the first, but this one just takes the cake."
611,9,"For me, the weakest of the Originals, but the most enjoyable...","Face it. Once you see ""Star Wars"" (or Episode IV, for all you ""Special"" Edition lovers) at least 54 times, everything sort of drags on. Once you see ""Return of the Jedi"", it kind of drags along, but, even though it is the longest, it seems to be the shortest. While ""Empire"" is VERY slow, it is easily the darkest and most enjoyable movie from the Original Trilogy, but for me, the least. As with ""Star Wars"" I'm gonna start the review with the Special Edition stuff. We don't need to see the ""VERY"" interesting approach to the Star Destroyer. The extra Wampa scene builds MUCH more tension than the original. And making Luke scream like a baby was Definitely cool. So, like the original ""Star Wars"" DON'T BUY OR WATCH THE SPECIAL EDITION! Again, I am proud to be the lucky owner of the original 3 movies unwrapped, and in mint condition after my success on ebay. I think it is obvious that The Empire Strikes Back is the darkest, including the fact that it has the stunning (MAJOR spoilers ahead!) ""I am your father!"" by James Earl Jones. As for the acting in this movie, second strongest, (Return of the Jedi has the strongest,in my opinion). Best actor/actress here- Frank Oz as Yoda. Well, he didn't really act, but oh, well. Againg, the effects in the Original Edition don't stick out like a sore thumb like in the Special Edition. The sets have gone a small, almost unnoticeable change: They don't look used! While many may argue that snow and woods can't look used (and I agree with them), Cloud City certainly can, and I think that there wasn't a scuff mark until the Stormtroopers attacked! Again, the music is GREAT! This time, my second favorite track, ""The Imperial March"" is introduced, and my fifth favorite, ""Yoda's Theme"" is introduced. Again, the DVD is fine (Luke doesn't scream), and I recommend it over the ""Special"" Edition. But, I recommend the Original Edition above all. May the Force be with you as you watch this movie!"
612,10,The best of the trilogy.,"""Empire"" is the best film of the original trilogy. Rather than remake the first film, Lucas takes the world that he devoped in the first movie and takes things even further. The story in this movie is better. There's much more character devolopment and the characters are fleshed out more. The movie takes a darker tone with the fate of Han Solo and the big revelation regarding Luke and Darth Vader. The bigger budget also helps allowing for improved special effects to complement the improvements from the first movie. Proof that not all sequels have to suck."
613,8,amazing,"This movie proves why the Star Wars series can last. What Lucas did was not just show the most advanced special effects technology at the time, build a complicated galaxy world, but truly become an epic movie. Everything you deserve: The most classic elements of insulting and cursing, rejoicing at your enemies, father and son, and apprentices and apprentices are cleverly combined. Even if the technology is outdated, the true soul of the space opera is still retained"
614,9,Amazing,Wow. What an epic.
615,10,"Wonderful, exciting, a masterwork...",This film is the living example that there can be sequels which are even better than the original.
616,8,Star Wars' Perfectly Great Sequel Deserves a Little Less Praise.,"Public opinion on popular movies has a way of snowballing towards one of two directions. A disappointing movie becomes an unholy dumpster fire and a solid sequel becomes an undisputed masterpiece. The Empire Strikes Back is certainly overrated. It's a great film, as are all the Star Wars movies (the six that count anyway), but Episode V is not a dramatic step up from A New Hope or any of the other films in the saga. The movie has become so overrated that many say it's not just the best Star Wars movie, but the only Star Wars movie that is any good at all. People are dumb. And I want to take the contrarian stance, but let's face facts, The Empire Strikes Back is a perfect sequel to the landmark movie event that was Star Wars. It deepens the mythology, lending George Lucas' world a gravity and psychological weight not seen in the buoyant original. It's also just as quirky and clunky as any other Star Wars film, so let us not rewrite history. TESB is a great film, a great Star Wars film, possibly the best of the six, but not the overwhelming triumph of the series that SO many people claim it to be."
617,5,Decent but too overrated,"TESB is a decent film no doubt, its way too overrated, the story and characters were not that too good, the dialogue was on-the-nose at times, the effects still hold up tho."
618,10,One of the best excellent films of all time!,"STAR WARS EPISODE V: THE EMPIRE STRIKES BACK is just a film that shows all of the qualities of a good sci-fi movie should be made, but also, how to make the best movie that is perfection. Overall, I think this film is a masterpiece and one of the best films of all time and this is why, but first, let me explain the film's story."
619,7,A good sequel,"This sequel to ""Star Wars"" is good but not great and although a tad overrated, it still delivers."
620,10,One of the best excellent films of all time!,"STAR WARS EPISODE V: THE EMPIRE STRIKES BACK is just a film that shows all of the qualities of a good sci-fi movie should be made, but also, how to make the best movie that is perfection. Overall, I think this film is a masterpiece and one of the best films of all time and this is why, but first, let me explain the film's story."
621,10,The best film I've ever seen,The Empire Strikes Back is my favorite movie of all time.
622,,Not as good as the other two,I didnt like this film as much as they other two basically because it was the middle of a trilogy.  We were left with too much to hope for with Return of the Jedi (which incidentally is why I think most people dislike Jedi the most).
623,10,"A Timeless Classic, Hands Down The Best Film Of The 80s","Guys...What can I say about ""Empire"" that hasn't already been said by countless fans, critics and film professors around the world? This is the movie that turned ""Star Wars"" from what was at the time little more than a soap opera in space into one of the greatest sagas in all of fiction. Its characters are diverse and well developed, its storytelling is magical, its effects are groundbreaking, its world-building is perfection, its allegories to classical literature and world mythology are brilliant. It is to science fantasy (And American cinema in general) what ""The Odyssey"" was to literature."
624,10,The Is No Room For Improvement....,"Not only the greatest sequel of all time, but without question its the greatest movie ever made!  Topping the first film (A New Hope) seemed impossible, but George Lucas and Irvin Kershner did it in 1980 with EMPIRE. A darker, deeper, more elaborate action packed film that skillfully tells two inter-connected stories as characters from the original movie are powerfully developed.  Luke Skywalker comes of age and realizes a terrible family secret.  Princess Liea and Han Solo try every means of evading the Empire but eventually end up in Darth Vader's hands.  The climax of the film is unforgettable and the special effects are not only impressive even by today's standards, but perfectly serve to tell this incredible story. I hope that the future of the Star Wars saga can capture the imagination and emotion that this sci-fi classic has done."
625,10,One of the best movies ever made,"Hands down, one of the best plot twists and movies in generell ever made.<br /><br />I am your father...<br /><br />Just perfect."
626,6,Not the best star wars,"From a release year standpoint this film, like the franchise itself, was ahead of its time. But there are numerous reasons it is not the best installment. The script between the romantic scenes are corny and do not feel sincere. The amount of puppetry used is almost suffocating compared to New Hope. But this is still a great film and should be regarded as a historical achievement for film."
627,10,A guys night out must watch,I don't think this needs a big intro as many around the globe has already rented or seen this on the big screen. Back then I had Empire on read along cassette with Danish narration by Peter Kitter. So famous tons of memes came by 3 decades later.
628,10,The best of the trilogy; an awesome space adventure!,"One of the rare sequels that arguably tops it's own classic predecessor, the second film in the original STAR WARS trilogy manages to seamlessly combine the cliffhanger thrills and good-natured humor of the original with a darker and more adult-oriented storyline. Producer/writer George Lucas (who also directed the first film) decided to pass the directorial duties over to semi-avant guard director Irvin Kershner (best known at the time for 1970's LOVING and 1972's UP THE SANDBOX), which proved to be an ingenious move. Kershner's dramatic background serves him well in helming the complex plot, and he pulls fully-rounded characterizations from the entire cast. The merging of Kershner's storytelling talents with Lucas' mastery of the film-making technique is the very heart of this, which is arguably the greatest space adventure ever."
629,8,The Empire strikes a home run!,"Even better than the first one, this movie is fun! Better special effects and bigger adventures and to top it all: the mother of all soap opera plots!(And I bet EVERYONE knows what I'm talking about) Unlike the first movie, this one is not a stand-alone movie and it connects directly to the third (or should I say sixth?) and final part. You still get the feeling of a complete story and it's f-u-n. Lucas is a genius. Great characters, great worlds of wonder... Wow. Oh, and make sure you watch the special edition! Just buy the special edition trilogy."
630,10,The best!,"I'm not afraid to say that this is the best Star Wars movie. A classic, with the most incredible plot twist of all. it's official: this film is timeless!"
631,9,One Of The Best Sequels Ever,"""The Empire Strikes Back"" is a stronger film than ""Star Wars"". The characters are stronger and more established and it is better made. This film is arguably the best sequel of all time, it expands on the original rather than remaking it. This is the best film out of all the ""Star Wars"" films though I really liked ""Episode 1"". A must see film."
632,,Perfect retaliation of A New Hope.,"The movie itself stands out as the second best Star Wars movie.  Perfectly showing a great dose of action, suspense and fun.  Yet with many kinds of tidbits of subplots like Luke's training in Dagobah, and the relationship of Han and Leia.  The Battle of Hoth scene was spectacular and the tragic fight between Luke and Darth Vader was outstanding.  One of the better films of the series."
633,10,One of the best movies of all time and the best in the saga!,"A New Hope was a very good movie, but something was missing. The plot wasn't the best, the characters could've been more fleshed out, but this movie has everything. It's one of those that are absolutely perfect. The acting, the effects, directing, plot, everything was just perfect. The acting is great and these characters were already likable in the previous movie, but here there is much more chemistry between them, they feel like they are real and you care about them much, much more. George Lucas isn't directing this time, but Irvin Kershner did a great job and directed the best Star Wars movie of all time! About the effects, I mostly think the same I thought about the previous movie. They are ahead of it's time, they aged well, and it was all practical, but it's so hard to believe. John Williams made a perfect score to the movie and here we are introduced to a theme of the Empire. There is especially that one unforgettable scene when that music plays and it fits perfectly. The plot is emotional, intense and that twist at the end will stick with you for a long time (of course, if someone didn't already spoil it to you). It's foreshadowing the next movie and sets it up in such a good way that it's impossible to top it. While the other movies have their flaws, this one is flawless and watchable over and over again. An absolute masterpiece!"
634,9,One of the Best Films Ever,"After the lighthearted adventure of the original, director Irvin Kershner delivers a darker, more thought provoking sequel that improves on everything that was in the first film and makes a near perfect movie."
635,9,I did have a review for this movie where is it?,Star Wars Episode 4 The Empire Strikes Back is a decent movie. How would Luke Skywalker have enough air to get to the planet doggybag I mean Dagobah I mean BraDacotah Sue luckrout. The Yodas are enigmatic yet sane in my opinion. Any appearance to the contrary is probably acting. As the Great Great Great Grandson of Governor Edwin Morgan a former Shadow President of America according to an American Government website I often think One wonders once ones won. To quote Joe Walsh lucky Im sane after all I've been through. The Yodas or You spasms helper? that Ugh President Attorney General Multiple Schlerosis help Elizabeth Regina and I both watch Human movies but we both sometimes cannot help critiquing the films we watch from many viewpoints like how many mistakes are there what are the funniest scenes? I often say thank God the Yodas appreciate Humor and gave we Humans that gift when they created us. Thanks to IMDb for supporting the kind of freedom of speech that Shadow President Jack F Kennedy my Great Uncle and Partial Father due to gene splicing support. Support IMDb
636,10,The Empire Strikes Back ... Again,"QUICK REVIEW SEPTEMBER 2020<br /><br />The 4K remaster is in cinemas and I was surprised how strong the movie is 40 years after its original release. The pure inspiration behind the traditional stop-motion, scale-model, and blue screen special effects, as well as the depth of practical sets, sound effects and score keep this film in the top 5 sci-fi/fantasy cinema experiences even today.<br /><br />In today's industry of movies made with the option for streaming at home, this movie stands out as something designed ... purely ... for ... the ... big ... screen (and sound system!). Everything is amplified and it is just pure epic ... ness!"
637,8,A balancing counterpart of the earlier part 'A new hope',"After Luke's and Leia's arrival the resistance gains strength, especially after the demise of the death star by Luke Skywalker. Darth Vader and the first Order do not take much time to find for the resistance who are by then placed in a cold planet called Hoth. <br /><br />This film has interesting elements like the Lightsaber fight between Darth Vader and Luke; the secret romance of Leia and Han Solo that is expressed in the end, etc. A balancing counterpart of the earlier part this shows First Order on the higher side while resistance tries to gain through Luke as the last hope. Luke find his way to Dagobah where he has interesting meet with Master Yoda who begins his training but that does not complete due to the his call on saving his friends Leia and Han. Luke manages to escape after a breathtaking fight as Leia helps with his rescue.<br /><br />The turns are twisted as Luke's training is incomplete and the Jedi have not returned; First order gain strength and Vader has turned invincible. All eyes are on Luke who is thought is bring new life to the Jedi."
638,,The Best sequel ever!,"ESB is as excellent as the original if not more so. It is very creepy,and dark which adds to it. The plot is perfect. The actors are even better than ANH. It is visually stunning. A lot of good fun. We learn more about the characters,and we learn the truth about Darth Vader,which has become one of the best scenes in the history of motion pictures. We also get the wee little Jedi Master Yoda.I love that little guy,he shines in this movie. See it again,and again. You will be thrilled every time!"
639,10,Another Great Sequel In A Great Trilogy,"There are few trilogies that have a sequel that matches up to the first. The Lord Of The Rings and The Godfather trilogies are two that I should mention. Once again, the technical aspects in this film are very impressive and advanced for 1980."
640,,Probably the best,"The Empire Strikes Back continues the Star Wars saga after the original Star Wars film. The Empire is hunting down the Rebellion and subsequently tracks them down on the icy planet Hoth. Luke and R2 split ways with Han and Leia (and Co.) - Luke travels to learn the ways of the Jedi, while Han and Leia hide out from the Empire in the Cloud City."
641,10,The Greatest Film Ever Made,"In the pantheon of great movie sequels, the line stops at Empire, having all the heart of the original while also taking the story down a new and darker path as it expands over countless new worlds and encompasses new ideas and themes. There is something for everyone here, from the bombastic battles on land and in space we've come to expect to meaningful explorations of the balance between good and evil, the light and the dark; it's everything a sequel should be and more, raising the bar as it raises the stakes and leading the franchise in bold new directions."
642,9,"Better Than the First, and the Greatest Science-Fiction Film Ever...","Coming from a hardcore fantasy fan, when it comes to science-fiction, Star Wars - Episode V - The Empire Strikes Back is the best of the best."
643,4,Nothing happens.,"A lot of fall out from a New Hope and build up to Return of the Jedi. But honestly not much happens. Not a lot of ""empire striking back"" for a movie titled Empire Strikes Back."
644,,Why it is the best,"It is the most well directed, most well-acted on and has the best story dynamics. At least better than any of the other SW films."
645,9,Great Movie,This is a good Movie but I rated it 9/10 because you have to see at least 1 or 2 of the previous movies.
646,9,Best Star Wars Film,"I love all of the original Star Wars films, but for me this one takes the biscuit. I have heard some people say that The Empire Strikes Back is the weakest of the trilogy, and that it suffers for being in the middle. I would dispute this utterly. For one thing, the plot has a slightly different format to the other two: instead of the old destroy-a-death-star scenario, we have the chance to learn more about the galaxy in general and to explore the characters in more depth. This is the film in which a lot of key character relationships are forged in earnest. It also includes, in my opinion, the best light sabre sequences: Alec Guiness may be a super actor, but he's not desperately nimble, whilst we do not have the same confidence in Luke as we do in Return of the Jedi."
647,10,The Best Sequel Ever!,"Luke lost his mentor Ben Kenobi,and goes to be trained by Yoda. While The evil Sith Lord Darth Vader looks for Luke,and captures his rebel allies. Little does Luke know of the connection he has to Vader. Wow this is a sequel that really out does the first! The Plot is excellent! Perfect! You'll love this exciting entry in The Star Wars saga. It also proves that Geogre Lucas can't make a prequel as good as The Original Trilogy!"
648,10,This is not a honest review,"So I decided to review the 3 Star Wars movies, all with the same review. Just because the last movies are horrible for me. So I will copy paste the same review. Star Wars is just the best movie for me. I was a kid when I first saw this... Wow... I dreamed about it, I was reading the 300+ page books, I played the video games etc. I played the music so many times... So it is not honest now to review the movie, I have no clear mind."
649,,The Standard Bearer of the Star Wars Universe,"The Empire Strikes Back, technically superior to Star Wars and dramatically superior to Return of the Jedi, still remains the best of the series. While not my favorite of the trilogy, I still am fascinated by the array of events that take place in this film.  It contains extreme contrasts, from the swampy Dagobah to the stark Cloud City, and gives the characters much more complex storylines.  Mark Hamill stands out once again as the intrepid Luke Skywalker, who finally gets a taste of the Dark Side while training with the legendary Yoda and with a botched confrontation with Darth Vader in Cloud City.  The rest of the group is trapped in space, without a working hyperdrive, and caught in the belly of a space slug.  ESB also offers a glimpse of Boba Fett, the enigmatic bounty hunter who had few lines, but unforgettable screen presence and a gigantic cult following ever since. The Special Edition of ESB is also a treat, with a enhanced and truly menacing Wampa on the icy Hoth, and great CGI effects on Bespin.  I highly recommend The Empire Strikes Back, but don't forget, this isn't a stand alone film. You have to see the entire series!  Hopefully, that won't be hard for any of us..."
650,8,Better than the first for sure!,"Although the First Star Wars movie was fun and full of action, I found that there was a certain depth that was lacking that could have made the film go a bit further. In ""The Empire Strikes Back,"" we see a little bit more character development in all the main characters. We see Luke's internal conflict with the dark side of the force, Han Solo's love for Princess Leia, and Leia's stubbornness but reciprocated love for Han Solo. We see that Darth Vader is evil, but not as pure evil as we might have expected in the first movie. Overall, the Empire Strikes Back goes one step further and not only goes into the back story behind each character, but also their psychology as well. It makes for an interesting watch, and with slightly better visual effects, also makes for a better film than the first instalment of the Star Wars saga."
