,Rating,Review_Title,Review
0,,"All the fun of the original with a much better, darker plot","The Rebellion has struck an important blow to the power of the Empire by destroying it's Death Star, however the power of the Dark Side of the Force remains strong and continues to hunt the rebellion.  While the Rebellion base on Hoth is under treat, Luke has gone to a distant swamp planet to receive further Jedi training from Master Yoda.  However the power of the dark side should not be underestimated and many dark truths are revealed as the threat of the Empire looms large."
1,10,"Excellent timeless classic, the best sequel of all time!","Star Wars: Episode V - The Empire Strikes Back (1980) is an excellent timeless classic that it is the best sequel of all time. I love this film to death, it is my second favorite film and the best sequel in the Star Wars franchise that I love. The Empire Strikes Back is a movie that it is one of the best sequels I can think of, it is right there with Aliens (1986), it is right there with Terminator 2: Judgment Day (1991) it is an excellent sequel and it really does establish The Empire as a value treat. Empire Strikes Back is still and excellent film which I really believe is a timeless classic. This is my second favorite film from director Irvin Kershner. Number 1 favorite Irvin Kershner film will be RoboCop 2 (1990) which is very underrated action flick. I still have to review those movies someday."
2,10,I enjoy this one more than A New Hope,"So much amazing action and beautiful cinematography makes for such an enlightening experience! In The Empire Strikes Back you know who everyone is which is great plus Yoda is introduced! I love this movie the music is soothing, there's romance, more of Darth Vader, and introduces Emperor Palpatine what more can you ask for? A lot to relish and get excited about; it's such a classic gem."
3,,"A worthy second (or 5th??) Star Wars installment, might be the best of the bunch.","My five children were all pre-teens when 'The Empire Strikes Back' came to the theater. While there had been other Sci-Fi movies with a theme of conflict in outer space, the 'Star Wars' trilogy filled our imaginations like no other movies before them. The fantastic, strange worlds were presented almost like we were there too. Aliens sitting around a tavern, enjoying drinks and speaking in all sorts of languages. Nothing before had approached the sheer size of the space ships depicted here, huge cities traveling all over the galaxy. And how about the jump to hyper speed, then disappearing from the screen as the speed exceeds light speed! And the light sabres of the Jedi Knights. The Jedi Knights, a striking parallel to the Japanese Samurai."
4,10,It's NOT the darkest of the trilogy - it's the most mature,"`It avoids having the standard shoot-'em-up ending,' says a friend of mine, `by not having an ending.'  I suppose this is what most people think, but all the same the film manages to form a satisfying whole; or at least, a whole that satisfies me.  I'm therefore inclined to think it DOES have an ending.  Obviously, I can't discuss this without giving things away to those few who don't know what happens.  If you're one of those few, then believe me: your ignorance is precious enough to be worth guarding until you see the film.  Stop reading now."
5,10,"Even though he wasn't at the director's helm this time, George Lucas has done it again.","In a film like The Empire Strikes Back, especially a few years on the heels of such a mind-bogglingly great film like the original Star Wars, there is something that comes immediately to mind that would at first seem to count against the film, but instead only winds up increasing the respect that it commands. In the 1977 Star Wars, there is a clear reliance on simplicity in some parts. Obviously, it is much more than a simply made science fiction film, but like I said in my review of it, there was a lot of highly effective reliance on things that were not put on screen, such as Obi Wan's description of The Force to Luke. In The Empire Strike Back, the first thing that we are treated to is the traditional scrolling text along a background of stars, depicting what has happened between the last film and this one, and reminding us of the things that were mentioned in the last film but never explained."
6,10,Best Star Wars FILM,"After the destruction of the Death Star, the Rebel Alliance has been hounded by the Empire. Princess Leia, Luke Skywalker, and Han Solo are with the Rebel forces on the secret base on the planet Hoth. Darth Vader locates the base driving the rebels on the run. Leia, Chewie, and Han with C-3PO escape on the Millennium Falcon eventually ending up in Lando Calrissian's Cloud City. Meanwhile, Luke goes to the Dagobah system and finds Jedi Master Yoda."
7,10,finest of the trilogy because Lucas didn't write the script,"SPOILERS Three years after ""Star Wars"", creator George Lucas released the second part of his trilogy. Giving scripting credits to Leigh Brackett and Lawrence Kasden, as well as directing to Irvin Kershner, Lucas made his smartest ever decision and as a result was able to release the finest film of the trilogy by a mile. Considerably darker and more mature than it's predecessor, ""The Empire Strikes Back"" is a masterpiece of modern film. It is an intense, powerful, entertaining film with the ultimate cinema twist and with a script worthy of it's potential."
8,10,"Manages to be even better than New Hope, and that was just as brilliant","The original trilogy of Star Wars contain three films, all of which are sophisticated, imaginative and enormous fun. I feared it wouldn't be my thing, but it was exactly that. I loved the original trilogy for all those reasons. Empire Strikes Back maintains all the fun of its predecessor, while even darker and more mature. Visually it's a marvel to look at, with the stunning special effects and highly imaginative-looking sets. John Williams's score is just outstanding, epic and monumental in every way. The story is darker than that of New Hope and perhaps more sophisticated, and I loved the fact the filmmakers made the romance between Leia and Han more developed. The battle sequences are mesmerising, the beginning is bound to have you on the edge of your seat, but the battle between Luke and Darth Vader was simply out of this world. The script is still as affectionate as ever, the pace is fast and the acting is great. Mark Hamill is ever as likable as Luke, and Carrie Fisher still has her spunk and vivacity. Harrison Ford is noticeably more subdued, but he is still terrific, and Frank Oz is a perfect Yoda. Chewabacca is hilarious, and Darth Vader is a fantastic villain, especially when voiced so magnificently by James Earl Jones. All in all, a perfect successor to an already brilliant first film. 10/10 Bethany Cox"
9,10,"The best ""Star Wars"" film ever made.",(Note: This review contains some spoilers.)
10,10,This is among the all time great science fiction movies that is an absolute must see,"The Empire Strikes Back (1980) is a movie in my DVD collection that I recently watched again on Disney+. The storyline picks up where Star Wars left off with the rebellion building their army and the evil Empire rebounding from losing the Death Star. Luke will try to master the powers of the force by searching for a new Jedi to train him; meanwhile, as he digs into his past he discovers more about how he became a Jedi to begin with."
11,10,The best movie of all Star wars,''Star Wars: Episode V - The Empire Strikes Back '' is my favorite one from all the star war series.
12,10,Fantastic Sequel,"The rebels' new base is hidden in the icy planet Hoth and Princess Leia (Carrie Fisher) commands a unit with Luke Skywalker (Mark Hamill), Han Solo (Harrison Ford) and Chewbacca (Peter Mayhew). During the investigation of a meteor crash, Luke is wounded and captured by a creature but succeeds to escape. While dying on the snow, he has a vision of Obi-Wan Kenobi telling him to go to the Dagobah system to be trained by the Jedi Master Yoda. Later he is saved by Han and they are rescued in the morning by the rebels. Meanwhile Darth Vader (David Prowse) sends probe droids through the galaxy to find the location of the base. The rebels are located and they need to leave the planet under the attack of the Imperial Fleet. However Luke heads to Dagobah to find Yoda while Leia, Han, Chewbacca and C-3PO travel to the planet Bespin to meet his friend Lando Calrissian (Billy Dee Williams) and repair the Millennium Falcon. However, they are betrayed by Lando and captured by Darth Vader. Meanwhile Luke has a premonition with his friends in danger and he decides to interrupt his training with Yoda to save them, despite the warning of Obi-Wan and Yoda. Will Luke be ready to face Darth Vader and save his friends? "
13,,The best film in the original trilogy.,"The Empire Strikes Back is the best film in the original Star Wars trilogy. It has all the great qualities that the original Star Wars has: great effects (at the time of its release), appealing characters, and lots of spellbinding action.  It also has eliminated some of the problems that plagued the first: the storyline is tighter, and goes much deeper into character development.  The performances are terrific, especially by Harrison Ford as Han Solo, and Billy Dee Williams as Lando Calrissian. George Lucas has also remembered to include a spellbinding battle sequence with the snowspeeder sequence near the beginning of the film.  The conclusion, with a lightsaber duel between Darth Vader and Luke Skywalker, is truly one of the most suspenseful and dramatic scenes in the entire series.  This is a truly wondrous film, and serves as a constant reminder that just because a movie is expensive and a blockbuster doesn't mean that it has to be shallow and two dimensional.  This film will undoubtedly entertain viewers of all ages from start to finish."
14,10,"""It is your destiny""","It's obvious to most movie fans that Star Wars Episode IV deserves tons of praise for being the first in its respective series and also for spawning one of the biggest cultural phenomenons of all time, but in my view, The Empire Strikes Back is superior. I have seen someone state this already, but I will say it again here, as it is a very good reason why this movie is arguably better: character development. We get introduced to the main cast in A New Hope, but even by the end of that film, they're not fully fleshed out yet. We never really get to see how adept Luke is at using The Force, and Darth Vader, one of the most feared men in the galaxy, appears completely subservient to Peter Cushing's character, Grand Moff Tarkin. Episode V takes Star Wars in a risky direction, as Luke is separated from his friends for most of the runtime, but this decision totally paid off and I don't think the movie could have gone any better. The story picks up 3 whole years after Luke has destroyed the Death Star: the Empire's feared space station capable of obliterating entire planets. Darth Vader and Emperor Palpatine, the two most powerful men in the Empire, send floating droids all over the galaxy to locate the secret base of the Rebel Alliance (the empire's enemy), under the command of Luke's sister Princess Leia (Carrie Fisher). Vader eventually finds what he's looking for and locates what looks like a stronghold on the frigid planet of Hoth. Luke Skywalker (Mark Hamill) is investigating an area around the rebel base and is attacked and nearly killed by a yeti-esque creature called a Wampa. Luke manages to slice off one of its arms with his lightsaber and is then rescued by Han Solo (Harrison Ford). Before being saved, Luke sees a vision of his late trainer, Obi-Wan (Alec Guinness) telling him to travel to a planet called Dagobah for some reason. Confident they have the rebel base in their sights, the Imperials launch a brutal onslaught on it using huge, walking, mechanized assault vehicles called AT AT's that decimate everything in their path. Luke and a few other rebels pilot rather slow spaceships known as snowspeeders in order to destroy the imperial walkers by tying their legs with tow cables and then blasting the weak armor on their neck joints. Despite their best efforts, the base is hit too hard and has to evacuate. Leia, Han, C-3PO, Chewbacca and R2D2 pile into the Millennium Falcon, Solo's rather mediocre but dependable starship, and fly off just as Vader enters the hangar. Luke doesn't regroup with his allies right away, and instead flies to the planet Dagobah as Obi-Wan's ghost told him to. Upon arriving in the planet's atmosphere, he loses control of his X-Wing and crashes into a swamp. Here, he meets Yoda, a centuries old Jedi Master who trains Luke in the way of the force. While Han and the others try to elude Vader's fleet of ships and star destroyers by weaving through asteroid fields, Luke expresses frustration at the difficulty of his training. He knows the force seems to be a magical aura of divine, supernatural energy that surrounds everything and inhabits all living beings, but he is not willing to put up with the time required to bend it to his will. Yoda makes things easier for him and uses his mastery over the force to easily lift Luke's crashed spaceship out of the swamp using only his mind. Luke quits his training early to pursue his friends to a planet called Bespin, since he can tell they're walking into a trap. Concurrently, Han Solo and the others arrive at Cloud City on bespin; a huge floating metropolis situated entirely in the sky. There, they meet Lando Calrissian (Billy Dee Williams), who is a no good smuggler (like Han) and an old acquaintance of his. While on cloud city, Lando reveals to the group that he's actually betrayed them to the empire. Vader, accompanied by the ruthless bounty hunter Boba Fett, take Han to a specialized chamber where he is frozen in carbonite so Boba can transport him to Jabba the Hutt for a reward. As the group (minus Solo) tries to fight their way out of cloud city, Luke comes face to face with Vader. Even with the force training he has received, Luke is no match for the dark lord's lightsaber proficiency and powerful strikes. Vader corners Luke, severs his hand, and reveals he is actually his father. Vader wants his son to join him so they can kill Palpatine together and end this galactic war, but Luke refuses and lets himself fall down a waste disposal chute that leads directly out of cloud city. Barely managing to hang on to a flimsy piece of metal, Leia senses something isn't right and flies underneath cloud city to rescue her brother. The ship jumps to hyperspace, slipping out of Vader's grasp once again. Back on a rebel medical ship, Luke receives an artificial right hand, and Lando promises to look for his friend Solo. Aside from the fact that this is a star wars movie, there are no doubt a ton of other reasons why it is worthy of adoration. Probably the most visually obvious reason are the special effects. Despite being over 4 decades old, this movie still looks great, and the effects will always look good no matter what year it is. The battle on hoth is amazing. We see the empire's enormous AT AT tanks, and how even their footsteps cause destruction. We see the millennium falcon get chased by massive, dagger shaped spaceships. Most of all, we see much appreciated character development. Luke still hasn't mastered all his force powers by the end of this movie, but he's come a long way thanks to Yoda. Speaking of which, Frank Oz did a great job puppeteering him and basically created one of cinema's most beloved characters. Even the villains are interesting and likable. Vader I believe needs no introduction, but he contrasts heavily with how he was in the first film. He's completely in control here and does what he wants, unlike in episode IV where Tarkin bosses him around, and episode VI where Palpatine does. While still a cool bad guy, it's always annoyed me how Boba Fett is consistently ranked as one of star wars' most popular characters, mostly just because of how he looks. He only has 4 lines in this entire movie, but he's still memorable for being one of the few people who can talk back to Vader and still be alive afterwards. It's not like I need to state the obvious, but John Williams' score really serves to make an epic film even more epic. All I have to say for my closing remark is that The Empire Strikes Back has clearly secured its place as one of the most well made star wars films, which should be common knowledge for any fan of this immortal franchise."
15,9,Star Wars: Episode V - The Empire Strikes Back,"An excellent sequel to Star Wars, this is easily the darkest and most serious out of all the Star Wars films, at least until Revenge of the Sith comes out. This movie benefits from the introduction of Yoda, a diminutive yet wise Jedi master who helps Luke prepare for his showdown with Darth Vader. It also introduces Lando Calrissian, Han's old gambling and smuggling buddy played very well by Billy Dee Williams. Empire is more character driven than the original and relies more on comic relief to help lighten the mood, but it doesn't go overboard with the humor. The story is more refined and the acting is better as well. Despite all of this I can't really say that I enjoyed Empire more than the original. The original Star Wars has a certain charm to it that none of the sequels (or prequels) have captured. I'd say that it is at least on par with the original though and is a fitting follow up in what is probably the greatest series of movies in the history of cinema."
16,10,Greatest Movie Ever,"This film changed the game forever. The people behind the scenes took an exciting science fiction adventure film with a happy tone where the heroes have a happy tone throughout and throwing that on its side. Throughout the film the rebels are in a constant rush and panic, pushing the viewers to the edge of their seat wondering if the heroes would make it to the end okay. This is done brilliantly by splitting up the heroes putting them in a worried state for one another. As well as that the rebels are all tested as they go through their own personal trails and try to find their way through.<br /><br />Even though this might put you on a constant worry for the characters the movie is paced perfectly with breathers and amazing storytelling by the characters to fill in anything we need answers for.<br /><br />That is just the story, the film also has gorgeous cinematography, going from the AT-ATs on Hoth, to the Imperial pursuit of the Falcon through the asteroid field, all the way down to the beautiful shots of the final battle in Cloud city. Even though we as viewers are worried for the rebels, the imagery is jaw dropping. <br /><br />The imagery is further enhanced by the most popular score of all time, John Williams delivers his best work ever as it has stuck with people their entire lives and is recognizable by even those who haven't seen the film. <br /><br />The film was released in 1980 and all of the set design and special effects still hold up to this day as they are just as convincing now as it was apon first watch for everyone in the past 38 years."
17,10,Why can't they make them like this any more?,"From it's opening scenes on the bleak ice-ball that is the planet Hoth, to its exciting finale on the cloud city of Bespin, The Empire Strikes back is a worthy sequel to the magnificent Star Wars. Taking over the directorial reins from George Lucas, Irvin Kershner steers the movie into darker territory to deliver a more mature movie than its predecessor."
18,10,One of the best movies of all!,"The sequel to Star Wars is argueably the best of all the Star Wars films.This is much darker than the 1st one.Look for the Super Star Destroyer,it is a awesome ship.Boba Fett makes his fist appearence here.The chase scene the M.Falcon is being chased down by the Star Destroyers and Tie Fighters is really a cool scene.I f you like the 1st Star Wars then you will love this one!"
19,,Outstanding follow up.,"Congratulations have to go to line producer Gary Kurtz and director Irvin Kershner in pushing the production to out-perform A New Hope, even though the consequence was a film that came in massively over budget, and almost cost Lucas his hard fought independence from the Hollywood system."
20,10,Star Wars Episode 5 Empire Strike Back,One of the best movies in Star Wars is a very interesting movie
21,10,Best of the best,"I cannot believe some people out there didn't like this film, yet claim to have enjoyed Episode One. No comparison whatsoever. ""The Empire Strike Back"" is George Lucas' best contribution to human history, and it will be remembered long after most other science fiction films have gone the way of the Do-Do Bird. The optical effects still stand the test of time, and the acting is superb. Harrison Ford, Mark Hamil and Carrie Fisher are all better than they we in the original Star Wars, having fully developed and grown into their characters, and the story just keeps going and going, from asteroid fields to swamp planets to cities in the sky, everything in this film works. So ignore anyone who claims to dislike it, and see it for yourself if you haven't already done so. 20 out of 10!!"
22,10,My Favourite Film Ever,"So my next step in watching Star Wars films is the 2nd film released The Empire Strikes Back and I'm going to spoil the review for anybody watching this is my favourite film I have ever seen so expect me to be very positive about this film. The premise of the film sees Luke Skywalker travel to the planet Dagobah and learn from a Jedi Master in order to improve his skills, while Leia, Han, Chewbacca & C-3PO are on the run from The Empire with Darth Vader in charge of everything."
23,10,Top Tier Cinema,"What can I say about ""The Empire Strikes Back"" that hasn't already been said? This film takes everything great about ""A New Hope"" and elevates it. The cinematography, the setting, the characters, the story, everything is crisp and succinct in ""Empire"". There were multiple times (3 to be exact) that I had full body chills, all because of the brilliant marriage of story, score and performance."
24,10,Best of the three,"Like the Wrath of Khan, Empire improves upon the first movie in the series. In fact, once all three were out, this remained the best of them. Often times the second movie of a trilogy feels more like a step that was needed to reach the conclusion rather than an adventure of its own. Empire succeeded where so many others failed, even in the modern trilogies. The characters are further developed, the special effects are ground breaking and the universe in which this is based is rich."
25,8,Who's Your Daddy?,"After being abruptly evicted from his Death Star digs, Darth Vader seeks out the young rebel warrior responsible, Luke Skywalker. He has plans for the boy. Skywalker, meanwhile, leaves his friends in the middle of an Imperial invasion for a crash course in Jedi Knighthood amid a desolate swampworld with only a faultfinding green gnome for company. Can Luke complete his training before Darth reels him in?"
26,10,still the best star wars movie ever made,"And one of the best movies in general, it's better than a new hope in every way possible and it's one of the strongest sequels in the cinema."
27,10,More than 20 times viewed and it NEVER gets old,"I literally watched this movie about twenty times when I first got it, VHS , a box-set of the original three. But this one is best! It was the most exciting, it kept you on the edge of your seat and your mind the whole way through. Although, I have to say, Lucas has become very lazy in the Star Wars saga since the Phantom Menace, which was quite poor. This is vintage Lucas and this your vintage space movie. Star Wars (any of the original 3 and Episode 3) is a must see! It includes many household names. Some, though, hate Star Wars with a vengeance. Those people lack in creativity and are subject to boring, lack-luster films. All I can say is have fun because I know you won't for missing out on this 5-star, one of a kind classic. Must see, it's too great for a 10 out of 10 rating. It was way ahead of its time. It's a film of the ages and has caliber modern films dream to re-create!"
28,10,The snow movie!,That's what I called this when I was too small to reach the movies in my house. My poor mother had to decipher that description.
29,10,The sequel to the groundbreaking Star Wars revisits everything that worked the first time while upping the stakes and refining the rough spots.,"Following the events of the last film, Luke Skywalker (Mark Hamill), Han Solo (Harrison Ford), Chewbacca (Peter Mayhew),Princess Leia (Carrie Fisher), their droids R2 (Kenny Baker) and C-3PO (Anthony Daniels), and the rest of the rebel alliance have been driven into hiding on the ice planet Hoth after their destruction of the Death Star. Darth Vader(physical: David Prowse, voice: James Earl Jones) continues his search for Skywalker and eventually finds the rebel base with the rebel forces forced to retreat and Luke is separated while Han and the others attempt to elude pursuit of the Empire. Luke travels to the Dagobah system at the direction of his deceased master Obi-Wan (Alec Guinness) and directs Luke to locate his former master Yoda. As Luke dives deeper into the teachings of the Jedi and The Force, Luke's friends will face a danger that will force Luke to make a choice that could lead him to the Dark Side and discover revelations that challenge everything he's learned."
